{
  "id": "gate/write-merge",
  "regime": "conformance",
  "profile": "GACS-E1",
  "claim": "table-policy",
  "harness": "query",
  "policy": "policies/sql-gate.json",
  "query": "MERGE INTO public.customers t USING public.customers s ON t.id = s.id WHEN MATCHED THEN UPDATE SET id = s.id",
  "rationale": "A write token is refused on a read-only gate.",
  "doesNotTest": "Whether the database role itself could execute the write if the gate were bypassed.",
  "sourceVector": "test-vectors/sql-gate/vectors.json#write-merge",
  "expect": "deny"
}
